"CYHMSUGX","book","2018","Harrington, Erin Jean","Women, monstrosity and horror film: gynaehorror","","978-1-4724-6729-4","","","","","2018","2020-09-16 14:34:35","2020-09-23 14:29:00","","","vi, 287","","","","","Women, monstrosity and horror film","Film philosophy at the margins ; 2","","","","Routledge, an imprint of the Taylor & Francis Group","Abingdon, Oxon ;","English","","","","","WorldCat Discovery Service","","Section: vi, 287 pages ; 24 cm.","","","","Criticism, interpretation, etc.; Frau.; Horror films History and criticism.; Horror films.; Horrorfilm; PERFORMING ARTS Reference.; Sexualität; Women in motion pictures.","","","","","","","","","","","","","","","","","","","","","","","","","","","","","","","","","","","","","","","","","","","","","","",""
"JHZNNWD9","book","2007","Edlund, Lena.; Kopczuk, Wojciech.; National Bureau of Economic Research.","Women, wealth and mobility","","","","","http://papers.nber.org/papers/w13162","","2007","2020-09-16 14:34:35","2020-09-23 14:30:41","2020-09-16 14:34:34","","44","","","","","","NBER working paper series ; no. 13162","","","","National Bureau of Economic Research","Cambridge, Mass.","English","","","","","WorldCat Discovery Service","","Section: 44 pages : illustrations ; 22 cm.","","","","History.; United States.; Wealth Women United States Mathematical models.; Women United States Economic conditions History Mathematical models.","","","","","","","","","","","","","","","","","","","","","","","","","","","","","","","","","","","","","","","","","","","","","","",""
"KEKRH6KX","book","2001","Zlotnick, Susan.","Women, writing, and the industrial revolution","","978-0-8018-6649-4","","","","","2001","2020-09-16 14:34:35","2020-09-22 20:25:15","","","viii, 325","","","","","","","","","","Johns Hopkins University Press","Baltimore, Md.","English","","","","","WorldCat Discovery Service","","Section: viii, 325 pages ; 22 cm","","","","1700-1899; Criticism, interpretation, etc.; Écrits de femmes anglais Histoire et critique.; Engels.; English literature -- 18th century -- History and criticism; English literature -- 19th century -- History and criticism; English literature -- Women authors -- History and criticism; English literature 18th century History and criticism.; English literature 19th century History and criticism.; English literature Women authors History and criticism.; English literature Women authors.; English literature.; Femmes et littérature Grande Bretagne Histoire 19e siècle.; Femmes et littérature Grande-Bretagne Histoire 18e siècle.; Great Britain.; History.; Industrial revolution -- Great Britain -- History; Industrial revolution -- Literary collections; Industrial revolution Great Britain History.; Industrial revolution in literature; Industrial revolution in literature.; Industrial revolution Literary collections.; Industrial revolution.; Industriële revolutie.; Industries -- Literary collections; Industries Anthologies.; Industries Literary collections.; Industries.; Literary collections.; Literature and technology -- Great Britain -- History; Literature and technology Great Britain History.; Literature and technology.; Literature.; Littérature anglaise 18e siècle Histoire et critique.; Littérature anglaise 19e siècle Histoire et critique.; Littérature et technologie Grande Bretagne Histoire.; Révolution industrielle Anthologies.; Révolution industrielle dans la littérature.; Révolution industrielle Grande-Bretagne Histoire.; Vrouwelijke auteurs.; Women and literature -- Great Britain -- History -- 18th century; Women and literature -- Great Britain -- History -- 19th century; Women and literature Great Britain History 18th century.; Women and literature Great Britain History 19th century.; Women and literature.","","","","","","","","","","","","","","","","","","","","","","","","","","","","","","","","","","","","","","","","","","","","","","",""
"ZMYRJUAI","book","2015","Abbas, Abul K.; Lichtman, Andrew H.; Pillai, Shiv","Cellular and molecular immunology","","978-0-323-22275-4 978-0-323-31614-9","","","https://studentconsult.inkling.com","","2015","2020-09-16 14:34:35","2020-09-23 14:31:24","2020-09-16 14:34:34","","viii, 535","","","","","","","","","","Elsevier Saunders","Philadelphia, PA","English","","","","","WorldCat Discovery Service","","Section: viii, 535 pages : illustrations (some color) ; 28 cm","","","","Antibody Formation immunology.; Antigen.; Antigens immunology.; Cellular immunity.; Health and Fitness.; Immune System Diseases immunology.; Immunité cellulaire.; Immunity, Cellular.; Immunologie moléculaire.; Immunologie.; Lymphocytes immunology.; Lymphozyt.; Molecular immunology.","","","","","","","","","","","","","","","","","","","","","Eighth edition.","","","","","","","","","","","","","","","","","","","","","","","","","",""
"8E95VJBS","book","2017","Davison, Carol Margaret","The Gothic and death","","978-1-78499-269-9","","","","","2017","2020-09-16 14:34:35","2020-09-23 14:31:03","","","xv, 240","","","","","","The international Gothic series","","","","Manchester University Press","Manchester","English","","","","","WorldCat Discovery Service","","Section: xv, 240 pages : illustrations ; 23 cm","","","","Criticism, interpretation, etc.; Death in literature.; Death in motion pictures.; Gothic fiction (Literary genre), English History and criticism.; Gothic fiction (Literary genre), English.","","","","","","","","","","","","","","","","","","","","","","","","","","","","","","","","","","","","","","","","","","","","","","",""
"WHBNQ9T5","book","2011","Thakur, S.","Women in science, engineering and technology","","978-81-7533-356-7","","","","","2011","2020-09-16 14:34:35","2020-09-22 20:26:03","","","vi, 271","","","","","","","","","","MD Publications","New Delhi","English","","","","","WorldCat Discovery Service","","Section: vi, 271 pages ; 22 cm","","","","Women in engineering.; Women in science.; Women in technology.","","","","","","","","","","","","","","","","","","","","","","","","","","","","","","","","","","","","","","","","","","","","","","",""
"6Y45HLP2","book","2016","Holmes, Thom","Electronic and experimental music : Pioneers in technology and composition","","978-1-138-79272-2 978-1-138-79273-9","","","","","2016","2020-09-16 14:34:35","2020-09-23 14:27:23","","","xxi, 562","","","","","Electronic and experimental music","","","","","Routledge","New York, NY ;","English","","","","","WorldCat Discovery Service","","Section: xxi, 562 pages : illustrations ; 26 cm","","","","Avant-garde (Music); Criticism, interpretation, etc.; Electronic music History and criticism.; Electronic music.; Elektronische muziek.; Experimentele muziek.; Musique électronique Histoire et critique.","","","","","","","","","","","","","","","","","","","","","Fifth edition.","","","","","","","","","","","","","","","","","","","","","","","","","",""
"Y7AV4N57","book","2014","Sandler, Ronald L.","Ethics and emerging technologies","","978-0-230-36703-6","","","http://www.netread.com/jcusers2/bk1388/036/9780230367036/image/lgcover.9780230367036.jpg","","2014","2020-09-16 14:34:35","2020-09-23 14:25:30","2020-09-16 14:34:35","","xv, 583","","","","","","","","","","Palgrave Macmillan","Houndsmills, Basingstoke, Hampshire ;","English","","","","","WorldCat Discovery Service","","Section: xv, 583 pages : illustrations ; 25 cm","","","","PHILOSOPHY Ethics & Moral Philosophy.; PHILOSOPHY Social.; SCIENCE Philosophy & Social Aspects.; Technology Moral and ethical aspects.","","","","","","","","","","","","","","","","","","","","","","","","","","","","","","","","","","","","","","","","","","","","","","",""
"LXJIIKFU","book","2016","Kenny, Aisling.; Wollenberg, Susan.","Women and the nineteenth-century Lied","","978-1-4724-3025-0","","","","","2016","2020-09-16 14:34:58","2020-09-22 20:23:11","","","xix, 275","","","","","","","","","","Routledge, Taylor & Francis Group","London","English","","","","","WorldCat Discovery Service","","Section: xix, 275 pages : music ; 24 cm","","","","1800-1899; 1800-talet; Criticism, interpretation, etc.; Kvinnliga tonsättare.; Lieder.; Music by women composers 19th century History and criticism.; Music by women composers.; Songs 19th century History and criticism.; Songs.","","","","","","","","","","","","","","","","","","","","","","","","","","","","","","","","","","","","","","","","","","","","","","",""
"XQ5Q3C3P","book","2018","Allen, Thomas M.","Time and literature","","978-1-108-42275-8","","","","","2018","2020-09-16 14:34:58","2020-09-22 20:24:24","","","xiii, 339","","","","","","Cambridge critical concepts series","","","","Cambridge University Press","Cambridge, United Kingdom ;","English","","","","","WorldCat Discovery Service","","Section: xiii, 339 pages ; 24 cm.","","","","Literature Philosophy.; Space and time Philosophy.; Time in literature.","","","","","","","","","","","","","","","","","","","","","","","","","","","","","","","","","","","","","","","","","","","","","","",""
"XATCQBR5","book","2017","King, Kathleen P.","Technology and innovation in adult learning","","978-1-119-04961-6","","","","","2017","2020-09-16 14:34:58","2020-09-22 20:22:48","","","xiv, 288","","","","","","","","","","Jossey-Bass, a Wiley Brand","San Francisco, CA","English","","","","","WorldCat Discovery Service","","Section: xiv, 288 pages ; 24 cm","","","","Adult learning.; Educational innovations.; Educational technology.","","","","","","","","","","","","","","","","","","","","","First edition.","","","","","","","","","","","","","","","","","","","","","","","","","",""
"ZKL6M89Z","book","2008","Schweitzer, Glenn E.; National Research Council (U.S.). Committee on the U.S.-Iran Workshop on Science and Technology and the Future Development of Societies.","Science and technology and the future development of societies: international workshop proceedings","","978-0-309-11927-6","","","","","2008","2020-09-16 14:34:58","2020-09-22 20:20:35","","","xi, 130","","","","","Science and technology and the future development of societies","","","","","National Academies Press","Washington, D.C.","English","","","","","WorldCat Discovery Service","","Section: xi, 130 pages : illustrations ; 23 cm","","","","Conference papers and proceedings.; Science Social aspects Congresses.; Science Social aspects.; Technology Social aspects Congresses.; Technology Social aspects.","","","","","","","","","","","","","","","","","","","","","","","","","","","","","","","","","","","","","","","","","","","","","","",""
"Y293D4Q2","book","2011","Prasad, D. N.","New information technology and women","","978-81-7533-360-4","","","","","2011","2020-09-16 14:34:58","2020-09-22 20:21:00","","","vi, 247","","","","","","","","","","MD Publications","New Delhi","English","","","","","WorldCat Discovery Service","","Section: vi, 247 pages ; 22 cm","","","","Computers and women.; Information technology Social aspects.; Women in computer science.","","","","","","","","","","","","","","","","","","","","","","","","","","","","","","","","","","","","","","","","","","","","","","",""
"CPF6LJNM","book","2003","Meskimmon, Marsha.","Women making art: history, subjectivity, aesthetics","","978-0-415-24277-6 978-0-415-24278-3","","","http://catdir.loc.gov/catdir/enhancements/fy0650/2004351627-d.html","","2003","2020-09-16 14:34:58","2020-09-22 20:21:29","2020-09-16 14:34:57","","xiv, 225","","","","","Women making art","","","","","Routledge","London ;","English","","","","","WorldCat Discovery Service","","Section: xiv, 225 pages : illustrations ; 24 cm","","","","20.10 art and society: general.; Ästhetik; Feminism and art.; Feminismus; Femme artiste.; Femmes artistes Histoire.; Femmes artistes.; Frau.; Frauenkunst; Geschlechterforschung; Histoire.; Kunst; Künstlerin; Kunsttheorie.; Kunstwissenschaft; Vrouwen.; Women artists.","","","","","","","","","","","","","","","","","","","","","","","","","","","","","","","","","","","","","","","","","","","","","","",""
"V7TGMERH","book","2002","Martínez Alemán, Ana M.; Renn, Kristen A.","Women in higher education: an encyclopedia","","978-1-57607-614-9","","","http://catdir.loc.gov/catdir/description/abcclio041/2002011570.html","","2002","2020-09-16 14:34:58","2020-09-22 20:21:53","2020-09-16 14:34:57","","xxiv, 637","","","","","Women in higher education","","","","","ABC-CLIO","Santa Barbara, Calif.","English","","","","","WorldCat Discovery Service","","Section: xxiv, 637 pages : illustrations ; 26 cm","","","","Encyclopedias.; Enseignement supérieur.; États-Unis.; Étudiante universitaire.; Féminisme.; Femme.; Femmes dans l'enseignement supérieur États-Unis Encyclopédies.; Genre.; Hoger onderwijs.; Professeure universitaire.; Programme d'études.; United States.; Vrouwen.; Women in higher education United States Encyclopedias.; Women in higher education.","","","","","","","","","","","","","","","","","","","","","","","","","","","","","","","","","","","","","","","","","","","","","","",""
"RC4EYR5C","book","2020","Gupta, Namrata","Women in science and technology: confronting inequalities","","978-93-5328-748-1","","","","","2020","2020-09-16 14:34:58","2020-09-22 20:23:32","","","xiv, 236","","","","","Women in science and technology","","","","","SAGE Publications India Pvt Ltd","New Delhi, India ;","English","","","","","WorldCat Discovery Service","","Section: xiv, 236 pages ; 23 cm","","","","Sex discrimination in employment India.; Sex discrimination in employment.; Women in science India.; Women in science.; Women in technology India.; Women in technology.","","","","","","","","","","","","","","","","","","","","","","","","","","","","","","","","","","","","","","","","","","","","","","",""
"GIE4LUXU","book","2003","Latham, Robert","Bombs and bandwidth: the emerging relationship between information technology and security","","978-1-56584-867-2 978-1-56584-862-7","","","","","2003","2020-09-16 14:34:58","2020-09-22 20:22:14","","","vi, 326","","","","","Bombs and bandwidth","","","","","New Press","New York","English","","","","","WorldCat Discovery Service","","Section: vi, 326 pages : illustrations ; 24 cm","","","","2000-2099; Aufsatzsammlung.; Information warfare.; Informationsnetz; Informationstechnik; Innere Sicherheit; Internet.; Military intelligence.; Military policy.; National security United States.; National security.; Organisiertes Verbrechen; Sicherheitspolitik; Überwachung; United States Military policy.; United States.; World politics 21st century.; World politics.","","","","","","","","","","","","","","","","","","","","","","","","","","","","","","","","","","","","","","","","","","","","","","",""
"9KMT3969","book","2006","Dusek, Val","Philosophy of technology: an introduction","","978-1-4051-1162-1 978-1-4051-1163-8","","","http://catdir.loc.gov/catdir/toc/ecip0518/2005025431.html","","2006","2020-09-16 14:34:58","2020-09-22 20:23:58","2020-09-16 14:34:58","","v, 244","","","","","Philosophy of technology","","","","","Blackwell Pub.","Malden, MA ;","English","","","","","WorldCat Discovery Service","","Section: v, 244 pages ; 24 cm","","","","Philosophie.; Technikphilosophie; Technologie.; Technology Philosophy.","","","","","","","","","","","","","","","","","","","","","","","","","","","","","","","","","","","","","","","","","","","","","","",""