&#65279;"Key","Item Type","Publication Year","Author","Title","Publication Title","ISBN","ISSN","DOI","Url","Abstract Note","Date","Date Added","Date Modified","Access Date","Pages","Num Pages","Issue","Volume","Number Of Volumes","Journal Abbreviation","Short Title","Series","Series Number","Series Text","Series Title","Publisher","Place","Language","Rights","Type","Archive","Archive Location","Library Catalog","Call Number","Extra","Notes","File Attachments","Link Attachments","Manual Tags","Automatic Tags","Editor","Series Editor","Translator","Contributor","Attorney Agent","Book Author","Cast Member","Commenter","Composer","Cosponsor","Counsel","Interviewer","Producer","Recipient","Reviewed Author","Scriptwriter","Words By","Guest","Number","Edition","Running Time","Scale","Medium","Artwork Size","Filing Date","Application Number","Assignee","Issuing Authority","Country","Meeting Name","Conference Name","Court","References","Reporter","Legal Status","Priority Numbers","Programming Language","Version","System","Code","Code Number","Section","Session","Committee","History","Legislative Body"
"UHZG863Q","book","2006","Cohoon, J. McGrath.; Aspray, William.","Women and information technology: research on underrepresentation","","978-0-262-03345-9","","","http://www.books24x7.com/marc.asp?bookid=12935","","2006","2020-09-16 14:31:22","2020-09-23 15:52:11","2020-09-16 14:31:20","","xviii, 500","","","","","Women and information technology","","","","","MIT Press","Cambridge, Mass.","English","","","","","WorldCat Discovery Service","","Section: xviii, 500 pages : illustrations ; 24 cm","","","","54.00 computer science: general.; 71.31 sexes and their interrelations.; Beruf; Computers and women.; Computers.; Différences entre sexes en éducation.; Education.; Frau.; Informaticiennes.; Informatik; Information technology.; Informationstechnik; Ordinateurs et femmes.; Sex differences in education.; Unterprivilegierung; Women computer scientists.; Women.","","","","","","","","","","","","","","","","","","","","","","","","","","","","","","","","","","","","","","","","","","","","","","",""
"CAHC4LBA","book","2006","Fox, Mary Frank.; Johnson, Deborah G.; Rosser, Sue Vilhauer.","Women, gender, and technology","","978-0-252-03095-6 978-0-252-07336-6","","","http://catdir.loc.gov/catdir/toc/ecip0614/2006018048.html","","2006","2020-09-16 14:31:22","2020-09-23 15:51:38","2020-09-16 14:31:20","","viii, 204","","","","","","Women, gender, and technology","","","","University of Illinois Press","Urbana","English","","","","","WorldCat Discovery Service","","Section: viii, 204 pages : illustrations ; 23 cm.","","","","Computers and women United States.; Computers and women.; Femmes, Effets des innovations sur les États-Unis.; Frau; Frau.; Informatietechnologie.; Information technology Social aspects United States.; Information technology Social aspects.; Ordinateurs et femmes États-Unis.; Sekseverschillen.; Technologie; Technologie de l'information Aspect social États-Unis.; Technologie.; United States.; USA; USA.; Verenigde Staten.; Vrouwen.; Women Effect of technological innovations on United States.; Women Effect of technological innovations on.","","","","","","","","","","","","","","","","","","","","","","","","","","","","","","","","","","","","","","","","","","","","","","",""
"7PJ972VH","book","2000","Vincentelli, Moira.","Women and ceramics: gendered vessels","","978-0-7190-3839-6 978-0-7190-3840-2","","","","","2000","2020-09-16 14:31:22","2020-09-23 15:49:14","","","xii, 290","","","","","Women and ceramics","Studies in design and material culture","","","","Manchester University Press ;","Manchester ;","English","","","","","WorldCat Discovery Service","","Section: xii, 290 pages : illustrations ; 25 cm","","","","Céramique Histoire.; Femmes céramistes.; Frau; Frau.; History.; Keramiek.; Keramik; Künstlerin; Pottery History.; Pottery.; Töpferei; Vrouwen.; Women potters.","","","","","","","","","","","","","","","","","","","","","","","","","","","","","","","","","","","","","","","","","","","","","","",""
"3UG3UJA6","book","2002","Ratcliff, Kathryn Strother","Women and health: power, technology, inequality, and conflict in a gendered world","","978-0-205-30597-1","","","","","2002","2020-09-16 14:31:22","2020-09-23 15:49:33","","","xii, 356","","","","","Women and health","","","","","Allyn and Bacon","Boston, MA","English","","","","","WorldCat Discovery Service","","Section: xii, 356 pages ; 24 cm","","","","Gezondheid.; Health Sex differences.; Maatschappelijke aspecten.; Medical care Sex differences.; Sociology, Medical.; Vrouwen.; Women Health and hygiene Sociological aspects.; Women's Health.","","","","","","","","","","","","","","","","","","","","","","","","","","","","","","","","","","","","","","","","","","","","","","",""
"Z8Y27UI7","book","2013","Goldman, Marlene B.; Troisi, Rebecca.; Rexrode, Kathryn M.","Women and health","","978-0-12-384978-6","","","http://0-www.sciencedirect.com.emu.londonmet.ac.uk/science/book/9780123849786","","2013","2020-09-16 14:31:22","2020-09-23 15:51:09","2020-09-16 14:31:21","","xxxi, 1581","","","","","","","","","","Elsevier/Academic Press","Amsterdam","English","","","","","WorldCat Discovery Service","","Section: xxxi, 1581 pages : illustrations","","","","Frau.; Gesundheit; Gynäkologie; Women Diseases.; Women Health and hygiene.; Women's Health.","","","","","","","","","","","","","","","","","","","","","2nd ed.","","","","","","","","","","","","","","","","","","","","","","","","","",""
"683BA47I","book","2007","Burke, Ronald J.; Mattis, Mary C.","Women and minorities in science, technology, engineering, and mathematics: upping the numbers","","978-1-84542-888-4 978-1-84720-687-9","","","http://catdir.loc.gov/catdir/toc/ecip0716/2007016049.html","","2007","2020-09-16 14:31:22","2020-09-23 15:52:35","2020-09-16 14:31:21","","xvii, 379","","","","","Women and minorities in science, technology, engineering, and mathematics","","","","","Edward Elgar","Cheltenham, UK ;","English","","","","","WorldCat Discovery Service","","Section: xvii, 379 pages : illustrations ; 24 cm","","","","Arbeitswelt; Berufsausbildung; Employment.; Engineering.; Frau; Frau.; Gleichberechtigung; Mathematics.; Mathematik; Minderheit; Minorities in engineering.; Minorities in mathematics.; Minorities in science.; Minorities in technology.; Minority Groups.; Naturwissenschaften; Science.; Technik; Technology.; Women in engineering.; Women in mathematics.; Women in science.; Women in technology.; Women.; Workforce.","","","","","","","","","","","","","","","","","","","","","","","","","","","","","","","","","","","","","","","","","","","","","","",""
"J7YZR8IT","book","2003","Leonard, Eileen B.","Women, technology, and the myth of progress","","978-0-13-098595-8","","","","","2003","2020-09-16 14:31:22","2020-09-23 15:50:39","","","x, 246","","","","","","","","","","Prentice Hall","Upper Saddle River, N.J.","English","","","","","WorldCat Discovery Service","","Section: x, 246 pages : illustrations ; 23 cm","","","","Progress.; Sex role.; Sociale ongelijkheid.; Technische ontwikkeling.; Technology and civilization.; Technology Social aspects.; Vrouwen.; Women Social conditions.","","","","","","","","","","","","","","","","","","","","","","","","","","","","","","","","","","","","","","","","","","","","","","",""
"5SKZ57E6","book","2003","Malloy, Judy","Women, art, and technology","","978-0-262-13424-8","","","http://catdir.loc.gov/catdir/toc/fy043/2002045178.html","","2003","2020-09-16 14:31:22","2020-09-23 15:50:20","2020-09-16 14:31:22","","xxix, 541","","","","","","Leonardo","","","","MIT Press","Cambridge, Mass.","English","","","","","WorldCat Discovery Service","","Section: xxix, 541 pages : illustrations ; 24 cm","","","","1900-1999; Art and technology History 20th century.; Art and technology.; Art et technologie Histoire 20e siècle.; Art et technologie.; Artes (filosofia) Século 20.; Ciência.; Femme.; Femmes et technologie Histoire 20e siècle.; History.; Kunst; Kunst.; Künstlerin; Künstlerin.; Medienkunst; Medienkunst.; Mulheres.; Neue Medien; Neue Medien.; Neue Technologie; Technische ontwikkeling.; Technology and women History 20th century.; Technology and women.; Tecnologia.; Vrouwen.","","","","","","","","","","","","","","","","","","","","","","","","","","","","","","","","","","","","","","","","","","","","","","",""
"U5VB3BAT","book","2000","Brenner, Johanna.","Women and the politics of class","","978-1-58367-009-5 978-1-58367-010-1","","","","","2000","2020-09-16 14:31:22","2020-09-23 15:52:55","","","vi, 330","","","","","","","","","","Monthly Review Press","New York","English","","","","","WorldCat Discovery Service","","Section: vi, 330 pages ; 24 cm","","","http://bvbr.bib-bvb.de:8991/F?func=service&doc_library=BVB01&local_base=BVB01&doc_number=009352569&line_number=0001&func_code=DB_RECORDS&service_type=MEDIA","Feminism Political aspects United States.; Feminism Political aspects.; Féminisme Aspect politique États-Unis.; Feminisme.; Féminisme.; Femmes dans le mouvement ouvrier États-Unis.; Femmes de la classe ouvrière États-Unis.; Femmes États-Unis Histoire 20e siècle.; Frauenliteratur; Kanada; Kanada.; Politiek.; Rôle selon le sexe.; Sociale klassen.; Sozialpolitik; United States.; Vrouwen.; Working class women United States.; Working class women.","","","","","","","","","","","","","","","","","","","","","","","","","","","","","","","","","","","","","","","","","","","","","","",""
"J8BK8EQA","book","2006","McClellan, James E. III; Dorn, Harold","Science and technology in world history: an introduction","","978-0-8018-8359-0 978-0-8018-8360-6","","","http://catdir.loc.gov/catdir/toc/ecip0519/2005027399.html","","2006","2020-09-16 14:31:22","2020-09-23 15:50:01","2020-09-16 14:31:22","","ix, 478","","","","","Science and technology in world history","","","","","Johns Hopkins University Press","Baltimore","English","","","","","WorldCat Discovery Service","","Section: ix, 478 pages : illustrations ; 24 cm","","","","History.; Naturwissenschaften; Naturwissenschaften.; Natuurwetenschappen.; Outilleurs Histoire.; Science history.; Science History.; Science.; Sciences Histoire.; Techniek.; Technik; Technik.; Technique Histoire.; Technologie; Technologie Histoire.; Technologie.; Technology history.; Technology History.; Technology.; Tool and die makers History.; Tool and die makers.; Wissenschaft; Wissenschaft.","","","","","","","","","","","","","","","","","","","","","2nd ed.","","","","","","","","","","","","","","","","","","","","","","","","","",""
"NKCT72GS","book","2001","Wyer, Mary.","Women, science, and technology: a reader in feminist science studies","","978-0-415-92607-2 978-0-415-92606-5","","","","","2001","2020-09-16 14:31:52","2020-09-23 15:45:56","","","xxviii, 376","","","","","Women, science, and technology","","","","","Routledge","New York","English","","","","","WorldCat Discovery Service","","Section: xxviii, 376 pages : illustrations ; 26 cm","","","http://bvbr.bib-bvb.de:8991/F?func=service&doc_library=BVB01&doc_number=009409784&line_number=0001&func_code=DB_RECORDS&service_type=MEDIA","Enseignement scientifique.; Feminism and science.; Feminism.; feminisme; Féminisme et sciences.; Féminisme.; Femmes dans les sciences.; Femmes en technologie.; Femmes.; Frau; Frau.; Genre.; kjønn; kvinner; naturvitenskap; Naturwissenschaften; Recherche scientifique et technique.; Science.; Sciences.; Scientifiques.; Technik; Technologie.; Technology.; teknologi; Vrouwenstudies.; Wetenschapsbeoefening.; Wissenschaft; Women in science.; Women in technology.; Women.","","","","","","","","","","","","","","","","","","","","","","","","","","","","","","","","","","","","","","","","","","","","","","",""
"VF9KCCAH","book","2017","Schmermund, Elizabeth","Women in technology","","978-0-7660-8149-9","","","","","2017","2020-09-16 14:31:52","2020-09-23 15:46:46","","","128","","","","","","Defying convention : women who changed the rules","","","","Enslow Publishing","New York, NY","English","","","","","WorldCat Discovery Service","","Section: 128 pages : illustrations (some color) ; 24 cm.","","","","Biographies.; History.; Juvenile works.; Literature.; Technology History Juvenile literature.; Technology History.; Technology.; Women Biography Juvenile literature.; Women Biography.; Women in technology History Juvenile literature.; Women in technology History.; Women in technology.; Women inventors.","","","","","","","","","","","","","","","","","","","","","","","","","","","","","","","","","","","","","","","","","","","","","","",""
"EHFDGR8H","book","2001","Joseph, Suad.; Slyomovics, Susan.","Women and power in the Middle East","","978-0-8122-3579-1 978-0-8122-1749-0","","","http://digitool.hbz-nrw.de:1801/webclient/DeliveryManager?application=DIGITOOL-3&owner=resourcediscovery&custom_att_2=simple_viewer&user=GUEST&pid=852435","","2001","2020-09-16 14:31:52","2020-09-23 15:47:14","2020-09-16 14:31:51","","vi, 237","","","","","","","","","","University of Pennsylvania Press","Philadelphia, PA","English","","","","","WorldCat Discovery Service","","Section: vi, 237 pages : illustrations ; 24 cm","","","","89.54 political influence.; Feminism Middle East.; Feminism.; Féminisme Moyen-Orient.; Feminisme.; Femmes en politique Moyen Orient.; Femmes Moyen-Orient Conditions sociales.; Femmes Moyen-Orient Histoire.; Frau.; Frauenbewegung; History.; Lobbyisme.; Middle East.; Naher Osten; Sekseverschillen.; Soziale Situation; Women Middle East History.; Women Middle East Social conditions.; Women Political activity Middle East.; Women Political activity.; Women Social conditions.; Women.","","","","","","","","","","","","","","","","","","","","","","","","","","","","","","","","","","","","","","","","","","","","","","",""
"UH4Z9UII","book","2001","Conrad, Lawrence I.; Hardy, Anne","Women and modern medicine","","978-90-420-0871-7 978-90-420-0861-8","","","","","2001","2020-09-16 14:31:52","2020-09-23 15:47:59","","","v, 293","","","","","","Clio medica, 0045-7183 ; 61","","","","Rodopi","Amsterdam ;","English","","","","","WorldCat Discovery Service","","Section: v, 293 pages : illustrations, 1 portrait ; 24 cm.","","","http://bvbr.bib-bvb.de:8991/F?func=service&doc_library=BVB01&local_base=BVB01&doc_number=009579615&line_number=0001&func_code=DB_RECORDS&service_type=MEDIA","Ärztin; Berufsbild; Congress.; Frau; Frau.; Geneeskunde.; Geschichte 1870-2000; Geschichte 1870-2000.; History.; Kongress; Medizin; modern medicine; Nursing.; Physician-Patient Relations.; Physicians, Women.; Sexism in medicine History.; Sexism in medicine.; Vrouwen.; women; Women Health and hygiene Sociological aspects.; Women physicians.; Women's Health Services history.","","","","","","","","","","","","","","","","","","","","","","","","","","","","","","","","","","","","","","","","","","","","","","",""
"DKD9DVE9","book","2008","Cohoon, J. McGrath.; Aspray, William.","Women and information technology: research on underrepresentation","","978-0-262-53307-2","","","","","2008","2020-09-16 14:31:52","2020-09-23 15:48:29","","","500","","","","","Women and information technology","","","","","MIT","Cambridge, Mass. ;","English","","","","","WorldCat Discovery Service","","Section: 500 pages : illustrations ; 25 cm","","","","54.00 computer science: general.; 71.31 sexes and their interrelations.; Beruf; Computers and women.; Computers.; Différences entre sexes en éducation.; Education.; Frau.; Informaticiennes.; Informatik; Information technology.; Informationstechnik; Ordinateurs et femmes.; Sex differences in education.; Unterprivilegierung; Women computer scientists.; Women.","","","","","","","","","","","","","","","","","","","","","","","","","","","","","","","","","","","","","","","","","","","","","","",""
"UNI7H2WK","book","2014","","Women and gender in science and technology.","","978-0-415-85560-0 978-0-415-85561-7 978-0-415-85562-4 978-0-415-85563-1 978-0-415-85564-8","","","","","2014","2020-09-16 14:31:52","2020-09-23 15:44:17","","","","","","","","","Critical concepts in historical studies","","","","Routledge, Taylor & Francis Group","London ;","English","","","","","WorldCat Discovery Service","","Section: 4 volumes : illustrations ; 24 cm.","","","","30.01 history of the exact sciences.; Frau; Geschlechterforschung; Technik; Wissenschaft; Women in science.; Women in technology.","","","","","","","","","","","","","","","","","","","","","","","","","","","","","","","","","","","","","","","","","","","","","","",""
"FA6NQRUZ","book","2005","Danilov, Victor J.","Women and museums: a comprehensive guide","","978-0-7591-0854-7 978-0-7591-0855-4","","","http://catdir.loc.gov/catdir/toc/ecip057/2005002692.html","","2005","2020-09-16 14:31:52","2020-09-23 15:47:37","2020-09-16 14:31:52","","vii, 285","","","","","Women and museums","American Association for State and Local History book series","","","","AltaMira Press","Lanham, MD","English","","","","","WorldCat Discovery Service","","Section: vii, 285 pages : illustrations ; 29 cm","","","","1800-1999; Biens culturels Protection.; Cultural property Protection United States.; Cultural property Protection.; Culture populaire États-Unis.; Directories.; États-Unis Vie intellectuelle 19e siècle.; États-Unis Vie intellectuelle 20e siècle.; Femmes États-Unis.; Frau; Frau.; Heimatmuseum der Gemeinde Gründau; Intellectual life.; Musées et femmes États-Unis.; Musées États-Unis Répertoires.; Museos Estados Unidos Directorios.; Museos y mujeres Estados Unidos.; Museum.; Museums and women United States.; Museums and women.; Museums United States Directories.; Museums.; Popular culture United States.; Popular culture.; United States Intellectual life 19th century.; United States Intellectual life 20th century.; United States.; USA; USA.; Women United States.; Women.","","","","","","","","","","","","","","","","","","","","","","","","","","","","","","","","","","","","","","","","","","","","","","",""
"MGAZRY2G","book","2015","Vasudeven, Padma; Sharma, VSatyawat; Sharma, V. P.; Verma, monica","Women, technology and development","","978-81-8487-449-5","","","","","2015","2020-09-16 14:31:52","2020-09-23 15:46:19","","","xvi, 281","","","","","","","","","","Narosa Publishing House","New Delhi","English","","","","","WorldCat Discovery Service","","Section: xvi, 281 pages : illustrations ; 24 cm","","","","India.; Technological innovations Economic aspects India.; Technological innovations Economic aspects.; Technology and women India.; Technology and women.; Women in development India.; Women in development.","","","","","","","","","","","","","","","","","","","","","","","","","","","","","","","","","","","","","","","","","","","","","","",""
"68KKELYD","book","2009","Wyer, Mary.","Women, science, and technology: a reader in feminist science studies","","978-0-415-96039-7 978-0-415-96040-3 978-0-203-89565-8","","","http://catdir.loc.gov/catdir/toc/ecip085/2007048799.html","","2009","2020-09-16 14:31:52","2020-09-23 15:45:34","2020-09-16 14:31:52","","xiv, 393","","","","","Women, science, and technology","MyiLibrary.","","","","Routledge","New York","English","","","","","WorldCat Discovery Service","","Section: xiv, 393 pages : illustrations ; 26 cm","","","","Feminism and science.; Feministisk teori.; Genusforskning.; Kvinnor och teknik.; Naturvetenskap.; Technologie.; Vrouwenstudies.; Wetenschapsbeoefening.; Women in science.; Women in technology.","","","","","","","","","","","","","","","","","","","","","2nd ed.","","","","","","","","","","","","","","","","","","","","","","","","","",""
"SPXPZC8T","book","2009","Amichai-Hamburger, Yair.","Technology and psychological well-being","","978-1-107-40228-7 978-0-521-88581-2","","","","","2009","2020-09-16 14:31:52","2020-09-23 15:48:55","","","xiii, 287","","","","","","","","","","Cambridge University Press","Cambridge, UK ;","English","","","","","WorldCat Discovery Service","","Section: xiii, 287 pages : illustrations ; 24 cm","","","","Psychische Gesundheit; Psychology, Social.; Sozialethik; Technischer Fortschritt; Technological innovations Psychological aspects.; Technological innovations Social aspects.; Technology Psychological aspects.; Technology Social aspects.","","","","","","","","","","","","","","","","","","","","","","","","","","","","","","","","","","","","","","","","","","","","","","",""
"LKMRM46N","book","2006","Hinkle-Turner, Elizabeth.","Women composers and music technology in the United States: crossing the line","","978-0-7546-0461-7","","","http://catdir.loc.gov/catdir/toc/ecip0512/2005014117.html","","2006","2020-09-16 14:32:07","2020-09-23 14:58:53","2020-09-16 14:32:06","","301","","","","","Women composers and music technology in the United States","","","","","Ashgate","Aldershot, Hants, England ;","English","","","","","WorldCat Discovery Service","","Section: 301 pages ; 24 cm","","","","Compositrices États-Unis.; Computer music History and criticism.; Computer music.; Computermusik; Criticism, interpretation, etc.; Electronic music History and criticism.; Electronic music.; Elektronische Musik; Komponistin; Musique électroacoustique Histoire et critique.; United States.; USA; USA.; Women composers United States.; Women composers.","","","","","","","","","","","","","","","","","","","","","","","","","","","","","","","","","","","","","","","","","","","","","","",""
"NCH6MRIP","book","2001","Muffoletto, Robert.","Education and technology: critical and reflective practices","","978-1-57273-282-7 978-1-57273-283-4","","","","","2001","2020-09-16 14:32:07","2020-09-23 14:57:54","","","vi, 312","","","","","Education and technology","Media education culture technology","","","","Hampton Press","Cresskill, N.J.","English","","","","","WorldCat Discovery Service","","Section: vi, 312 pages : illustrations ; 24 cm.","","","","Aufsatzsammlung.; Educational technology.; Unterrichtstechnologie.; USA.","","","","","","","","","","","","","","","","","","","","","","","","","","","","","","","","","","","","","","","","","","","","","","",""
"S7ZJ39US","book","2015","Despotopoulou, Anna","Women and the railway, 1850-1915","","978-0-7486-7694-1","","","","","2015","2020-09-16 14:32:07","2020-09-23 15:43:49","","","x, 202","","","","","","Edinburgh Critical Studies in Victorian Culture","","","","Edinburgh University Press","Edinburgh","English","","","","","WorldCat Discovery Service","","Section: x, 202 pages : illustrations ; 25 cm.","","","","1850-1815; English literature 19th century History and criticism.; Railroad travel Great Britain History.; Railroad travel in literature.; Railroads.; Women travelers Great Britain History.; Women travelers in literature.; Women.","","","","","","","","","","","","","","","","","","","","","","","","","","","","","","","","","","","","","","","","","","","","","","",""
"YCF4K8GU","book","2001","Wosk, Julie.","Women and the machine: representations from the spinning wheel to the electronic age","","978-0-8018-6607-4 978-0-8018-7313-3","","","http://site.ebrary.com/id/10021510","","2001","2020-09-16 14:32:07","2020-09-23 14:57:12","2020-09-16 14:32:06","","xix, 294","","","","","Women and the machine","","","","","Johns Hopkins University Press","Baltimore","English","","","","","WorldCat Discovery Service","","Section: xix, 294 pages : illustrations (some color) ; 26 cm","","","","Femmes dans l'art.; Femmes dans la culture populaire.; Femmes, Effets des innovations sur les.; Frau; Frau.; Geschichte; Industriële productie.; Innovations Aspect social.; Kunst; Representatie (algemeen); Rôle selon le sexe.; Sex role.; Techniek.; Technik; Technische Innovation; Technological innovations Social aspects.; Technologie Aspect social.; Technologie dans l'art.; Technology in art.; Technology Social aspects.; Volkskultur; Vrouwen.; Women Effect of technological innovations on.; Women in art.; Women in popular culture.","","","","","","","","","","","","","","","","","","","","","","","","","","","","","","","","","","","","","","","","","","","","","","",""
"BLPMTNAD","book","2010","Gee, James Paul.; Hayes, Elisabeth.","Women and gaming: the Sims and 21st century learning","","978-0-230-62341-5 978-1-349-38471-6","","","https://www.loc.gov/catdir/enhancements/fy1609/2009038279-t.html","","2010","2020-09-16 14:32:07","2020-09-23 15:43:09","2020-09-16 14:32:06","","207","","","","","Women and gaming","","","","","Palgrave Macmillan","New York","English","","","","","WorldCat Discovery Service","","Section: 207 pages : illustrations ; 25 cm","","","","Datorspel genusaspekter.; Elektroniska spel.; Sims.; Simulation games in education.; Simulationsspiel; Video games for women.; Video games Social aspects.","","","","","","","","","","","","","","","","","","","","","1st ed.","","","","","","","","","","","","","","","","","","","","","","","","","",""
