"YJHXQZZ2","book","2005","Riordan, Jan.","Breastfeeding and human lactation","","978-0-7637-4585-1 978-1-4175-8407-9","","","http://catdir.loc.gov/catdir/toc/ecip0410/2003022400.html","","2005","2020-09-16 14:33:09","2020-09-23 14:42:06","2020-09-16 14:33:08","","xxv, 819","","","","","","Jones and Bartlett series in breastfeeding/human lactation","","","","Jones and Bartlett","Sudbury, Mass.","English","","","","","WorldCat Discovery Service","","Section: xxv, 819 pages : illustrations (some color) ; 26 cm + 1 CD-ROM (4 3/4 in.).","","","","Borstvoeding.; Breast Feeding.; Breastfeeding.; CD-ROMs.; Infant Nutritional Physiological Phenomena.; Lactatie.; Lactation.; Milk, Human.; Moedermelk.","","","","","","","","","","","","","","","","","","","","","3rd ed.","","","","","","","","","","","","","","","","","","","","","","","","","",""
"7SNRPB3U","book","2003","Jones, Amelia.","The feminism and visual culture reader","","978-0-415-26705-2 978-0-415-26706-9","","","","","2003","2020-09-16 14:33:09","2020-09-23 14:42:58","","","xxix, 560","","","","","","In sight","","","","Routledge","London ;","English","","","","","WorldCat Discovery Service","","Section: xxix, 560 pages : illustrations, portraits ; 25 cm.","","","http://bvbr.bib-bvb.de:8991/F?func=service&doc_library=BVB01&doc_number=010126769&line_number=0001&func_code=DB_RECORDS&service_type=MEDIA","Ästhetik; Beeldcultuur.; Communication visuelle.; Culture populaire.; Culture.; Ethnicité; Étude de genre.; Feminism and the arts.; Feminism.; Féminisme et arts.; Feminisme.; Féminisme.; Feminismus; Feminismus.; Femme.; Genre.; Identité raciale.; Kultur; Kunstwissenschaft; Popular culture.; Visual communication.; Visuelle Kommunikation; Visuelle Medien; Visuelle Medien.; Visuelle Wahrnehmung","","","","","","","","","","","","","","","","","","","","","","","","","","","","","","","","","","","","","","","","","","","","","","",""
"YHKIW93F","book","2005","Silk, Michael L.; Andrews, David L.; Cole, Cheryl L.","Sport and corporate nationalisms","","978-1-85973-794-1 978-1-85973-799-6","","","http://catdir.loc.gov/catdir/toc/ecip051/2004023158.html","","2005","2020-09-16 14:33:09","2020-09-23 14:41:24","2020-09-16 14:33:08","","xi, 292","","","","","","Sport, commerce and culture","","","","Berg","Oxford ;","English","","","","","WorldCat Discovery Service","","Section: xi, 292 pages : illustrations ; 24 cm.","","","","Corporate sponsorship.; Nationalism and sports.; Sports Economic aspects.; Sports Marketing.","","","","","","","","","","","","","","","","","","","","","","","","","","","","","","","","","","","","","","","","","","","","","","",""
"XAHJ4IM5","book","2008","Rosser, Sue Vilhauer","Women, science, and myth: gender beliefs from antiquity to the present","","978-1-59884-095-7","","","http://catdir.loc.gov/catdir/enhancements/fy0811/2008009359-d.html","","2008","2020-09-16 14:33:09","2020-09-23 14:41:44","2020-09-16 14:33:08","","xvii, 502","","","","","Women, science, and myth","","","","","ABC-CLIO","Santa Barbara, Calif.","English","","","","","WorldCat Discovery Service","","Section: xvii, 502 pages : illustrations ; 27 cm","","","","Discriminatie (sociologie); Könsskillnader forskning.; Kvinnorollen forskning.; Natuurwetenschappen.; Sekseverschillen.; Sex customs.; Sex differences Research.; Sex role Research.; Vrouwen.; Wetenschapsbeoefenaars.","","","","","","","","","","","","","","","","","","","","","","","","","","","","","","","","","","","","","","","","","","","","","","",""
"FQSPKIMP","book","2016","Domínguez-Rué, Emma; Nierling, Linda","Ageing and technology: perspectives from the social sciences","","978-3-8376-2957-6","","","","","2016","2020-09-16 14:33:09","2020-09-23 14:43:42","","","339","","","","","Ageing and technology","Science studies","","","","Transcript","Bielefeld","English","","","","","WorldCat Discovery Service","","Section: 339 pages ; 23 cm.","","","","Technology and older people.","","","","","","","","","","","","","","","","","","","","","","","","","","","","","","","","","","","","","","","","","","","","","","",""
"E88TS95X","book","2002","Business Women's Network (Firm)","Women and diversity: WOW! facts 2002.","","978-0-9656430-9-2","","","","","2002","2020-09-16 14:33:09","2020-09-23 14:44:00","","","xxxiii, 846","","","","","Women and diversity","","","","","Business Women's Network","Washington, D.C.","English","","","","","WorldCat Discovery Service","","Section: xxxiii, 846 pages : illustrations ; 23 cm","","","","Businesswomen United States.; Businesswomen.; United States.; Women employees United States.; Women employees.","","","","","","","","","","","","","","","","","","","","","3rd ed.","","","","","","","","","","","","","","","","","","","","","","","","","",""
"QVQCZRVV","book","2000","Stam, Robert; Miller, Toby","Film and theory: an anthology","","978-0-631-20625-5 978-0-631-20626-2","","","","","2000","2020-09-16 14:33:09","2020-09-23 14:41:03","","","xviii, 862","","","","","Film and theory","","","","","Blackwell","Malden, Mass.","English","","","","","WorldCat Discovery Service","","Section: xviii, 862 pages ; 24 cm","","","http://bvbr.bib-bvb.de:8991/F?func=service&doc_library=BVB01&doc_number=008709488&line_number=0001&func_code=DB_RECORDS&service_type=MEDIA","Cinéma Histoire et critique.; Critique cinématographique.; Films.; Filmtheorie; Filmtheorie.; Motion pictures.","","","","","","","","","","","","","","","","","","","","","","","","","","","","","","","","","","","","","","","","","","","","","","",""
"4ZE5AN97","book","2006","Chinoy, Helen Krich.; Jenkins, Linda Walsh.","Women in American theatre","","978-1-55936-263-4 978-1-55936-180-4","","","http://catdir.loc.gov/catdir/description/cons041/00037753.html","","2006","2020-09-16 14:33:31","2020-09-23 14:39:12","2020-09-16 14:33:27","","xxxv, 555","","","","","","","","","","Theatre Communications Group","New York","English","","","","","WorldCat Discovery Service","","Section: xxxv, 555 pages ; 23 cm","","","","Drama.; Englisch.; Frau <Motiv>; Frau.; Theater.; Theaterwissenschaft.; United States.; USA.; Women in the theater United States.; Women in the theater.","","","","","","","","","","","","","","","","","","","","","Rev. and expanded 3rd ed.","","","","","","","","","","","","","","","","","","","","","","","","","",""
"SLMYP4UX","book","2000","Bart, Jody","Women succeeding in the sciences: theories and practices across disciplines","","978-1-55753-121-6 978-1-55753-122-3","","","http://ets.umdl.umich.edu/cgi/t/text/text-idx?c=epv2;cc=epv2;view=toc;idno=BAY2442.0001.001","","2000","2020-09-16 14:33:31","2020-09-23 14:40:17","2020-09-16 14:33:28","","x, 277","","","","","Women succeeding in the sciences","","","","","Purdue University Press","West Lafayette, Ind.","English","","","","","WorldCat Discovery Service","","Section: x, 277 pages ; 24 cm","","","","Aufsatzsammlung; Geschichte; Lehrveranstaltung; Naturwissenschaftlerin; Naturwissenschaftliches Studium; Science education.; Science Study and teaching.; Women Education.; Women in science.; Women.","","","","","","","","","","","","","","","","","","","","","","","","","","","","","","","","","","","","","","","","","","","","","","",""
"7ZNYHVT8","book","2009","Herzfeld, Noreen L.","Technology and religion: remaining human in a co-created world","","978-1-59947-313-0","","","","","2009","2020-09-16 14:33:31","2020-09-23 14:38:44","","","viii, 167","","","","","Technology and religion","Templeton science and religion series","","","","Templeton Press","West Conshohocken, Pa.","English","","","","","WorldCat Discovery Service","","Section: viii, 167 pages ; 22 cm.","","","","Bioethik.; Religion and science.; Religion och vetenskap.; Technology Moral and ethical aspects.; Technology Religious aspects.; Teknik religiösa aspekter.","","","","","","","","","","","","","","","","","","","","","","","","","","","","","","","","","","","","","","","","","","","","","","",""
"R8LXIMQA","book","2008","Center on Integrated Rural Development for Asia and the Pacific.","Appropriate technology for rural women: report of the regional consultation, 14-16 August 2006, Yangon, Myanmar.","","","","","","","2008","2020-09-16 14:33:31","2020-09-23 14:39:32","","","vi, 133","","","","","Appropriate technology for rural women","CIRDAP study series ; 203","","","","The Centre on Integrated Rural Development for Asia and the Pacific","Dhaka","English","","","","","WorldCat Discovery Service","","Section: vi, 133 pages : illustrations ; 23 cm.","","","","Appropriate technology Asia Congresses.; Appropriate technology.; Asia.; Asiatisch-Pazifischer Raum; Conference papers and proceedings.; Frau; Ländliche Entwicklung; Technischer Fortschritt; Women in rural development Asia Congresses.; Women in rural development.","","","","","","","","","","","","","","","","","","","","","","","","","","","","","","","","","","","","","","","","","","","","","","",""
"ZYB7Q2I9","book","2011","Parkinson, Claire L.; Millar, Pamela S.; Thaller, Michelle.; Goddard Space Flight Center.; Maryland Women's Heritage Center.","Women of Goddard: careers in science, technology, engineering & mathematics","","","","","","","2011","2020-09-16 14:33:31","2020-09-23 14:37:12","","","112","","","","","Women of Goddard","","","","","NASA Goddard Space Flight Center","Greenbelt, Md.","English","","","","","WorldCat Discovery Service","","Section: 112 pages : color illustrations ; 28 cm","","","","Employees.; Goddard Space Flight Center Officials and employees.; Goddard Space Flight Center.; Government publications United States.; Maryland Greenbelt.; Women in astronautics Maryland Greenbelt.; Women in astronautics.","","","","","","","","","","","","","","","","","","","","","","","","","","","","","","","","","","","","","","","","","","","","","","",""
"XPVJADNN","book","2011","Klenke, Karin.","Women in leadership: contextual dynamics and boundaries","","978-0-85724-561-8","","","","","2011","2020-09-16 14:33:31","2020-09-23 14:37:59","","","xv, 284","","","","","Women in leadership","","","","","Emerald Group Pub.","Bingley, UK","English","","","","","WorldCat Discovery Service","","Section: xv, 284 pages ; 25 cm","","","","Leadership in women.; Leadership.","","","","","","","","","","","","","","","","","","","","","1st ed.","","","","","","","","","","","","","","","","","","","","","","","","","",""
"T8IRNGRW","book","2010","Kumar, P.","Women and digital divide","","978-81-7533-266-9","","","","","2010","2020-09-16 14:33:31","2020-09-23 14:37:34","","","vi, 256","","","","","","","","","","MD Publications","New Delhi","English","","","","","WorldCat Discovery Service","","Section: vi, 256 pages ; 23 cm","","","","Computers and women.; Information technology Social aspects.; Internet and women.","","","","","","","","","","","","","","","","","","","","","","","","","","","","","","","","","","","","","","","","","","","","","","",""
"FMQKTQJC","book","2002","Yaszek, Lisa","The self wired: technology and subjectivity in contemporary narrative","","978-0-415-93964-5","","","","","2002","2020-09-16 14:33:31","2020-09-23 14:36:37","","","vii, 209","","","","","The self wired","Literary criticism and cultural theory.","","","","Routledge","New York","English","","","","","WorldCat Discovery Service","","Section: vii, 209 pages ; 24 cm","","","http://bvbr.bib-bvb.de:8991/F?func=service&doc_library=BVB01&local_base=BVB01&doc_number=009856124&line_number=0001&func_code=DB_RECORDS&service_type=MEDIA","18.06 Anglo-American literature.; 1900-1999; American fiction 20th century History and criticism.; American fiction.; Amerikaans.; Biomedical engineering United States.; Biomedical engineering.; Criticism, interpretation, etc.; Cybernetics in literature.; Cyborgs in literature.; Erzähltechnik; History.; Identiteit.; Identity (Psychology) in literature.; Letterkunde.; Literature and technology United States History 20th century.; Literature and technology.; Medical technology United States.; Medical technology.; Narration (Rhetoric); Narration (Rhetoric) History 20th century.; Science fiction films United States History and criticism.; Science fiction films.; Science fiction, American History and criticism.; Science fiction, American.; Science fiction.; Science-Fiction; Science-Fiction-Film; Science-Fiction-Literatur; Subjectivity in literature.; Technologie; Technologie.; Technology in literature.; Technology in motion pictures.; United States.; USA; USA.","","","","","","","","","","","","","","","","","","","","","","","","","","","","","","","","","","","","","","","","","","","","","","",""
"X6PDYAX9","book","2012","Kearney, Mary Celeste","The gender and media reader","","978-0-415-99345-6 978-0-415-99346-3","","","","","2012","2020-09-16 14:33:31","2020-09-23 14:38:20","","","ix, 714","","","","","","","","","","Routledge","New York","English","","","","","WorldCat Discovery Service","","Section: ix, 714 pages : illustrations ; 26 cm","","","","Arbete kreativitet marknadsföring teknik.; Kropp film identitet representation strategier.; Mass media and culture.; Mass media and sex.; Massmedia genusaspekter.; Massmedia könsroller kultur genusforskning.; Sex role in mass media.","","","","","","","","","","","","","","","","","","","","","","","","","","","","","","","","","","","","","","","","","","","","","","",""
"ER8FGAHC","book","2013","Caplan, Sheri J.","Petticoats and pinstripes: portraits of women in Wall Street's history","","978-1-4408-0265-2","","","","","2013","2020-09-16 14:33:31","2020-09-23 14:39:56","","","xviii, 258","","","","","Petticoats and pinstripes","","","","","Praeger","Santa Barbara","English","","","","","WorldCat Discovery Service","","Section: xviii, 258 pages : illustrations ; 25 cm","","","","Biographies.; Finanzwirtschaft; Frau.; Geschlechterverhältnis; History.; Kreditwesen; Securities industry United States History.; Securities industry.; United States.; USA.; Women capitalists and financiers United States Biography.; Women capitalists and financiers.","","","","","","","","","","","","","","","","","","","","","","","","","","","","","","","","","","","","","","","","","","","","","","",""
"NSEBQDYB","book","2010","Godfroy-Genin, Anne-Sophie.; PROMETEA (Project)","Women in engineering and technology research: the PROMETEA conference proceedings","","978-3-643-10457-1","","","","","2010","2020-09-16 14:34:19","2020-09-23 14:34:38","","","730","","","","","Women in engineering and technology research","Prometea ; v. 1","","","","Lit","Berlin","English","","","","","WorldCat Discovery Service","","Section: 730 pages : illustrations ; 22 cm.","","","","Conference papers and proceedings.; Frau; Frau Naturwissenschaften.; Frau.; Ingenieurwissenschaften; Ingenieurwissenschaften.; Naturwissenschaften Frau.; Paris <2007>; Technik; Women in engineering Congresses.; Women in engineering.; Women in technology Congresses.; Women in technology.","","","","","","","","","","","","","","","","","","","","","","","","","","","","","","","","","","","","","","","","","","","","","","",""
"N8F8YC9X","book","2014","","Women and information, communication technology.","","978-93-82252-44-3","","","","","2014","2020-09-16 14:34:19","2020-09-23 14:31:58","","","","","","","","","","","","","PACIFIC Books INTERNATION","[Place of publication not identified]","English","","","","","WorldCat Discovery Service","","","","","","NONE FOUND","","","","","","","","","","","","","","","","","","","","","","","","","","","","","","","","","","","","","","","","","","","","","","",""
"4W9TIBE8","book","2005","Lu, Jinky Leilanie Del Prado-","Gender, information technology, and health","","978-971-542-482-0","","","","","2005","2020-09-16 14:34:19","2020-09-23 14:33:29","","","viii, 219","","","","","","","","","","University of the Philippines Press","Diliman, Quezon City","English","","","","","WorldCat Discovery Service","","Section: viii, 219 pages : illustrations ; 23 cm","","","http://bvbr.bib-bvb.de:8991/F?func=service&doc_library=BVB01&doc_number=016443389&line_number=0001&func_code=DB_RECORDS&service_type=MEDIA","Arbeitsschutz; Electronic industries Technological innovations Philippines.; Electronic industries Technological innovations.; Frauenarbeit; Informationstechnik; Occupational Health.; Philippinen; Philippines.; Technology.; Textile industry Technological innovations Philippines.; Textile industry Technological innovations.; Textile Industry.; Women electronic industry workers Effect of technological innovations on Philippines.; Women electronic industry workers Health and hygiene Philippines.; Women electronic industry workers Health and hygiene.; Women factory workers Philippines; Women textile workers Effect of technological innovations on Philippines.; Women textile workers Health and hygiene Philippines.; Women textile workers Health and hygiene.; Women.","","","","","","","","","","","","","","","","","","","","","","","","","","","","","","","","","","","","","","","","","","","","","","",""
"6WIZY5ZU","book","2006","Organisation for Economic Co-operation and Development.","Women in scientific careers: unleashing the potential.","","978-92-64-02537-0","","","https://doi.org/10.1787/9789264025387-en","","2006","2020-09-16 14:34:19","2020-09-23 14:32:29","2020-09-16 14:34:17","","228","","","","","Women in scientific careers","","","","","Organisation for Economic Co-operation and Development","[Paris, France]","English","","","","","WorldCat Discovery Service","","Section: 228 pages : illustrations ; 28 cm","","","","Femmes scientifiques Pays de l'OCDE.; Femmes Travail Pays de l'OCDE.; Forskning genusaspekter.; Karriär.; Kvinnliga forskare OECD-länderna.; Kvinnor arbete och arbetsmarknad OECD-länderna.; OECD countries.; Women Employment OECD countries.; Women Employment.; Women scientists OECD countries.; Women scientists.","","","","","","","","","","","","","","","","","","","","","","","","","","","","","","","","","","","","","","","","","","","","","","",""
"NQ2V9IMM","book","2010","Jones, Amelia","The feminism and visual culture reader","","978-0-415-54369-9 978-0-415-54370-5","","","","","2010","2020-09-16 14:34:19","2020-09-23 14:34:20","","","xxxv, 693","","","","","","In sight","","","","Routledge","London ;","English","","","","","WorldCat Discovery Service","","Section: xxxv, 693 pages : illustrations ; 26 cm.","","","","Ästhetik; Beeldcultuur.; Communication visuelle.; Culture populaire.; Culture.; Ethnicité; Étude de genre.; Feminism and the arts.; Feminism.; Féminisme et arts.; Feminisme.; Féminisme.; Feminismus; Feminismus.; Femme.; Genre.; Identité raciale.; Kultur; Kunstwissenschaft; Popular culture.; Visual communication.; Visuelle Kommunikation; Visuelle Medien; Visuelle Medien.; Visuelle Wahrnehmung","","","","","","","","","","","","","","","","","","","","","Second edition.","","","","","","","","","","","","","","","","","","","","","","","","","",""
"F9IQURFP","book","2009","Chandra Bhanu, T. K.; Bhatnagar, Vasudev","Women in science and technology","","978-81-8030-220-6","","","","","2009","2020-09-16 14:34:19","2020-09-23 14:35:27","","","278","","","","","","","","","","Campus Books International","New Delhi","English","","","","","WorldCat Discovery Service","","Section: 278 pages ; 25 cm","","","","Women in science.; Women in technology.","","","","","","","","","","","","","","","","","","","","","1st ed.","","","","","","","","","","","","","","","","","","","","","","","","","",""
"BN446JLL","book","2002","McLeod, Carolyn.","Self-trust and reproductive autonomy","","978-0-262-13408-8","","","","","2002","2020-09-16 14:34:19","2020-09-23 14:33:01","","","xiii, 199","","","","","","Basic bioethics","","","","MIT Press","Cambridge, Mass.","English","","","","","WorldCat Discovery Service","","Section: xiii, 199 pages ; 24 cm.","","","","Autonomy.; Bioethics.; Ethics, Clinical.; Ethics.; Feminism Health aspects.; Feminism Moral and ethical aspects.; Feminism.; Feminismus; Frau.; Human reproduction Moral and ethical aspects.; Human reproductive technology Moral and ethical aspects.; Medical ethics.; Patient; Personal Autonomy.; Professional-Patient Relations.; Reproduction.; Reproductive Techniques psychology.; Selbstbestimmung; Trust.; Women psychology.","","","","","","","","","","","","","","","","","","","","","","","","","","","","","","","","","","","","","","","","","","","","","","",""
"P6K92VZK","book","2007","Barzilai, Gad.","Law and religion","","978-0-7546-2494-3","","","","","2007","2020-09-16 14:34:19","2020-09-23 14:36:15","","","xxviii, 528","","","","","","International library of essays in law and society","","","","Ashgate","Aldershot, England ;","English","","","","","WorldCat Discovery Service","","Section: xxviii, 528 pages : illustrations ; 25 cm.","","","","Freedom of religion.; Liberté religieuse.; Religion and law.; Religion and state.; Religion et droit.; Religion et État.","","","","","","","","","","","","","","","","","","","","","","","","","","","","","","","","","","","","","","","","","","","","","","",""
"6W2B4VM2","book","2014","Lewis, Anna M.","Women of steel and stone: 22 inspirational architects, engineers, and landscape designers","","978-1-61374-508-3 978-1-61373-667-8","","","http://www.chicagoreviewpress.com","","2014","2020-09-16 14:34:19","2020-09-23 14:33:56","2020-09-16 14:34:18","","264","","","","","Women of steel and stone","Women of action","","","","Chicago Review Press","Chicago","English","","","","","WorldCat Discovery Service","","Section: 264 pages : illustrations ; 22 cm.","","","","Architects.; Biographies.; Engineers.; Ingenjörer.; JUVENILE NONFICTION Architecture.; JUVENILE NONFICTION Biography & Autobiography Science & Technology.; JUVENILE NONFICTION Biography & Autobiography Women.; JUVENILE NONFICTION Girls & Women.; Juvenile works.; Kvinnliga arkitekter.; Kvinnor.; Landscape architects.; Landskapsarkitekter.; Studie- och yrkesorientering.; Vocational guidance.; Women architects Biography Juvenile literature.; Women architects Biography.; Women architects.; Women Biography.; Women engineers Biography Juvenile literature.; Women engineers Biography.; Women engineers.; Women landscape architects Biography Juvenile literature.; Women landscape architects Biography.; Women landscape architects.; Women Vocational guidance Juvenile literature.; Women Vocational guidance.","","","","","","","","","","","","","","","","","","","","","First edition.","","","","","","","","","","","","","","","","","","","","","","","","","",""
"ESY7FJ7Y","book","2014","Buskens, Ineke; Webb, Anne","Women and ICT in Africa and the Middle East: changing selves, changing societies","","978-1-78360-042-7 978-1-78360-043-4","","","","","2014","2020-09-16 14:34:19","2020-09-23 14:35:49","","","ix, 326","","","","","Women and ICT in Africa and the Middle East","","","","","Zed Books","London","English","","","","","WorldCat Discovery Service","","Section: ix, 326 pages : illustrations ; 21 cm","","","","Africa.; Information technology Social aspects Africa.; Information technology Social aspects Middle East.; Information technology Social aspects.; Middle East.; Technology and women Africa.; Technology and women Middle East.; Technology and women.; Women Effect of technological innovations on Africa.; Women Effect of technological innovations on Middle East.; Women Effect of technological innovations on.; Women in development Africa.; Women in development Middle East.; Women in development.","","","","","","","","","","","","","","","","","","","","","","","","","","","","","","","","","","","","","","","","","","","","","","",""
"QPSDHTR3","book","2009","Frize, Monique; Frize, Peter R. D.; Faulkner, Nadine","The bold and the brave: a history of women in science and engineering","","978-0-7766-0725-2","","","https://www.loc.gov/catdir/enhancements/fy1616/2008460336-b.html","","2009","2020-09-16 14:34:35","2020-09-23 14:30:23","2020-09-16 14:34:33","","xvi, 348","","","","","The bold and the brave","","","","","University of Ottawa Press","Ottawa","English","","","","","WorldCat Discovery Service","","Section: xvi, 348 pages : illustrations ; 20 cm","","","","Erziehung.; Femmes dans les sciences Biographies.; Femmes dans les sciences Histoire.; Femmes Éducation Histoire.; Femmes en ingénierie Histoire.; Femmes Vie intellectuelle.; Frau.; History.; Ingenieurin.; Naturwissenschaftlerin.; Women Education History.; Women Education.; Women in engineering History.; Women in engineering.; Women in science History.; Women in science.; Women Intellectual life.","","","","","","","","","","","","","","","","","","","","","","","","","","","","","","","","","","","","","","","","","","","","","","",""
"JC4TRYTL","book","2014","Gibson, Karen Bush.","Women in space: 23 stories of first flights, scientific missions, and gravity-breaking adventures","","978-1-61374-844-2","","","","","2014","2020-09-16 14:34:35","2020-09-23 14:29:39","","","234","","","","","Women in space","Women of action","","","","Chicago Review Press, Incorporated","Chicago, Illinois","English","","","","","WorldCat Discovery Service","","Section: 234 pages : illustrations ; 23 cm.","","","","Biographies.; History.; Juvenile works.; Women astronauts Biography Juvenile literature.; Women astronauts Biography.; Women astronauts.; Women in astronautics History Juvenile literature.; Women in astronautics History.; Women in astronautics.; YOUNG ADULT NONFICTION / Biography & Autobiography / Science & Technology.; YOUNG ADULT NONFICTION / Biography & Autobiography / Women.; YOUNG ADULT NONFICTION / Technology / Aeronautics, Astronautics & Space Science.","","","","","","","","","","","","","","","","","","","","","","","","","","","","","","","","","","","","","","","","","","","","","","",""
