"QVJZH8KU","book","2001","Green, Eileen; Adam, Alison.","Virtual gender: technology, consumption, and identity","","978-0-415-23314-9 978-0-415-23315-6","","","http://link.library.utoronto.ca/eir/EIRdetail.cfm?Resources__ID=1052892&T=F","","2001","2020-09-16 14:32:07","2020-09-23 14:59:17","2020-09-16 14:32:07","","xxi, 330","","","","","Virtual gender","","","","","Routledge","London ;","English","","","","","WorldCat Discovery Service","","Section: xxi, 330 pages ; 23 cm","","","","05.20 communication and society.; 71.43 technology and society.; Computers and women.; Consumptiemaatschappij.; Femmes Travail, Effets des innovations sur le.; Frau; Frau.; Geschlechterforschung; Informatiemaatschappij.; Innovations Aspect social.; Neue Medien; Ordinateurs et femmes.; Recreatie.; Sekserol.; Technological innovations Social aspects.; Technologie Aspect social.; Technologie.; Technology Social aspects.; Virtuele gemeenschappen.; Women Effect of technological innovations on.","","","","","","","","","","","","","","","","","","","","","","","","","","","","","","","","","","","","","","","","","","","","","","",""
"CVAT2TNT","book","2009","Jauhari, Vinnie.; Griffy-Brown, Charla.","Women, technology and entrepreneurship: global case studies","","978-81-8405-042-4","","","","","2009","2020-09-16 14:32:07","2020-09-23 14:58:36","","","xxv, 463","","","","","Women, technology and entrepreneurship","","","","","Reference Press","New Delhi","English","","","","","WorldCat Discovery Service","","Section: xxv, 463 pages : illustrations, map ; 23 cm","","","","Businesswomen Case studies.; Businesswomen India Case studies.; Businesswomen.; Case studies.; Entrepreneurship Case studies.; Entrepreneurship India Case studies.; Entrepreneurship.; India.; Women in technology Case studies.; Women in technology India Case studies.; Women in technology.","","","","","","","","","","","","","","","","","","","","","","","","","","","","","","","","","","","","","","","","","","","","","","",""
"YM72STEV","book","2019","Esri Press","Women and GIS: mapping their stories","","978-1-58948-528-0 978-1-58948-567-9","","","","","2019","2020-09-16 14:32:07","2020-09-23 15:43:26","","","xiii, 215","","","","","Women and GIS","","","","","Esri Press","Redlands, California","English","","","","","WorldCat Discovery Service","","Section: xiii, 215 pages : color illustrations, maps (chiefly color) ; 26 cm","","","","Biographies.; Geographic information systems.; Women geographers Biography.; Women geographers.","","","","","","","","","","","","","","","","","","","","","","","","","","","","","","","","","","","","","","","","","","","","","","",""
"VF85VK5H","book","2005","Kleinman, Daniel Lee.","Science and technology in society: from biotechnology to the Internet","","978-0-631-23181-3 978-0-631-23182-0","","","http://catdir.loc.gov/catdir/toc/ecip059/2005007227.html","","2005","2020-09-16 14:32:07","2020-09-23 14:58:16","2020-09-16 14:32:07","","x, 141","","","","","Science and technology in society","Key themes in sociology","","","","Blackwell Pub.","Malden, MA","English","","","","","WorldCat Discovery Service","","Section: x, 141 pages ; 24 cm.","","","","71.43 technology and society.; Einfluss; Einfluss.; Naturwissenschaften; Naturwissenschaften.; Science and civilization.; Science Social aspects.; Sciences Aspect social.; Sciences et civilisation.; Sociale aspecten.; Sociologische aspecten.; Technologie; Technologie Aspect social.; Technologie et civilisation.; Technologie.; Technology and civilization.; Technology Social aspects.; Wetenschappen.","","","","","","","","","","","","","","","","","","","","","","","","","","","","","","","","","","","","","","","","","","","","","","",""
"TAJMZNIW","book","2008","Phipps, Alison.","Women in science, engineering and technology: three decades of UK initiatives","","978-1-85856-402-9","","","","","2008","2020-09-16 14:32:07","2020-09-23 14:57:30","","","v, 183","","","","","Women in science, engineering and technology","","","","","Trentham Books","Stoke-on-Trent","English","","","","","WorldCat Discovery Service","","Section: v, 183 pages ; 24 cm","","","http://bvbr.bib-bvb.de:8991/F?func=service&doc_library=BVB01&doc_number=016460061&line_number=0001&func_code=DB_RECORDS&service_type=MEDIA","Beruf; Frau.; Great Britain.; Industrial arts Vocational guidance Government policy Great Britain.; Kvinnopolitik Storbritannien.; Kvinnor och teknik.; Naturvetenskap.; Utbildningsval genusaspekter.; Women in science Government policy Great Britain.; Women in science Government policy.; Women Vocational guidance Government policy Great Britain.; Yrkesval Storbritannien.","","","","","","","","","","","","","","","","","","","","","","","","","","","","","","","","","","","","","","","","","","","","","","",""
"U8EP7ZNF","book","2000","Moisala, Pirkko.; Diamond, Beverley","Music and gender","","978-0-252-02544-0 978-0-252-06865-2","","","http://lcweb.loc.gov/catdir/toc/99006791.html","","2000","2020-09-16 14:32:35","2020-09-23 14:55:08","2020-09-16 14:32:33","","xiii, 376","","","","","","","","","","University of Illinois Press","Urbana","English","","","","","WorldCat Discovery Service","","Section: xiii, 376 pages : illustrations ; 24 cm","","","","Musiciennes; Sex in music.; Sexualité dans la musique; Women musicians.","","","","","","","","","","","","","","","","","","","","","","","","","","","","","","","","","","","","","","","","","","","","","","",""
"M8GA95WD","book","2009","Ridley, Frances.","Stuntmen and women","","978-1-84696-938-6","","","","","2009","2020-09-16 14:32:35","2020-09-23 14:54:17","","","","","","","","","CLASH","","","","Ticktock","Tunbridge Wells","English","","","","","WorldCat Discovery Service","","Section: pages cm.","","","","Cinematography Special effects Juvenile literature.; Cinematography Special effects.; Juvenile works.; Stunt performers Juvenile literature.; Stunt performers.","","","","","","","","","","","","","","","","","","","","","","","","","","","","","","","","","","","","","","","","","","","","","","",""
"MF8W5TKE","book","2011","Ames, Melissa; Burcon, Sarah Himsel","Women and language: essays on gendered communication across media","","978-0-7864-4944-6","","","","","2011","2020-09-16 14:32:35","2020-09-23 14:56:46","","","viii, 236","","","","","Women and language","","","","","McFarland","Jefferson, N.C.","English","","","","","WorldCat Discovery Service","","Section: viii, 236 pages ; 23 cm","","","","Communicatie.; Geschichte.; Language and languages Sex differences.; Mass media and women.; Massamedia.; Sekseverschillen.; Technology and women.; Vrouwen.; Women Language.; Women.","","","","","","","","","","","","","","","","","","","","","","","","","","","","","","","","","","","","","","","","","","","","","","",""
"KGYL72M7","book","2014","Wyer, Mary","Women, science, and technology: a reader in feminist science studies","","978-0-415-52109-3 978-0-415-52110-9 978-1-135-05542-4","","","","","2014","2020-09-16 14:32:35","2020-09-23 14:53:09","","","xxxiv, 599","","","","","Women, science, and technology","","","","","Routledge","New York","English","","","","","WorldCat Discovery Service","","Section: xxxiv, 599 pages ; 24 cm","","","","Enseignement scientifique.; Feminism and science.; Feminism.; feminisme; Féminisme et sciences.; Féminisme.; Femmes dans les sciences.; Femmes en technologie.; Femmes.; Frau; Frau.; Genre.; kjønn; kvinner; naturvitenskap; Naturwissenschaften; Recherche scientifique et technique.; Science.; Sciences.; Scientifiques.; Technik; Technologie.; Technology.; teknologi; Vrouwenstudies.; Wetenschapsbeoefening.; Wissenschaft; Women in science.; Women in technology.; Women.","","","","","","","","","","","","","","","","","","","","","Third edition.","","","","","","","","","","","","","","","","","","","","","","","","","",""
"W7GTU722","book","2017","Perritano, John","Science and technology","","978-1-4222-3641-3","","","","","2017","2020-09-16 14:32:35","2020-09-23 14:54:48","","","64","","","","","","The making of the modern world: 1945 to the present","","","","Mason Crest","Broomall, PA","English","","","","","WorldCat Discovery Service","","Section: 64 pages : illustrations (some color) ; 24 cm.","","","","1900-1999; Civilization, Modern 20th century Juvenile literature.; Civilization, Modern 20th century.; Civilization, Modern.; History.; Juvenile works.; Modern civilization.; Science History 20th century Juvenile literature.; Science History 20th century.; Science History.; Science.; Technology History 20th century Juvenile literature.; Technology History 20th century.; Technology History.; Technology.; Twentieth century Juvenile literature.; Twentieth century.; World history 20th century.","","","","","","","","","","","","","","","","","","","","","","","","","","","","","","","","","","","","","","","","","","","","","","",""
"4GGCL88W","book","2007","Watts, Ruth","Women in science: a social and cultural history","","978-0-415-25306-2 978-0-415-25307-9 978-0-203-96235-0","","","http://catdir.loc.gov/catdir/toc/fy1002/2007019707.html","","2007","2020-09-16 14:32:35","2020-09-23 14:53:33","2020-09-16 14:32:34","","ix, 300","","","","","Women in science","","","","","Routledge","London ;","English","","","","","WorldCat Discovery Service","","Section: ix, 300 pages ; 24 cm","","","","02.01 history of science and culture.; Forskare.; Geschichte; History.; Kulturhistoria.; Kvinnliga vetenskapsmän historia.; Naturvetenskap medicin representation 1700-talet 1800-talet 1900-talet.; Science history.; Utbildning.; Vrouwen.; Wetenschapsbeoefenaars.; Women history.; Women in science History; Women in science History.; Women in science Social aspects; Women in science Social aspects.; Women in science.","","","","","","","","","","","","","","","","","","","","","","","","","","","","","","","","","","","","","","","","","","","","","","",""
"Y4TE89V6","book","2018","Green, Jen","Women in science","","978-1-4654-6860-4 978-1-4654-6859-8 978-0-7804-0038-2 978-1-5182-5354-6","","","http://www.perma-bound.com/ws/image/cover/000152980/m","","2018","2020-09-16 14:32:35","2020-09-23 14:55:55","2020-09-16 14:32:34","","64","","","","","","DK. Level 3, Beginning to read alone","","","","DK Publishing","New York, New York","English","","","","","WorldCat Discovery Service","","Section: 64 pages : illustrations (some color) ; 23 cm.","","","","Biographies.; Chapter-headings.; JUVENILE NONFICTION Biography & Autobiography Science & Technology.; JUVENILE NONFICTION Biography & Autobiography Women.; JUVENILE NONFICTION Reader Intermediate.; Juvenile works.; Readers (Primary); Readers (Publications); Women in science Biography.; Women in science Juvenile literature.; Women in science.","","","","","","","","","","","","","","","","","","","","","First American edition.","","","","","","","","","","","","","","","","","","","","","","","","","",""
"INPU4JC3","book","2009","Heitmann, John Alfred.","The automobile and American life","","978-0-7864-4013-9","","","","","2009","2020-09-16 14:32:35","2020-09-23 14:55:33","","","xi, 248","","","","","","","","","","McFarland & Co.","Jefferson, N.C.","English","","","","","WorldCat Discovery Service","","Section: xi, 248 pages : illustrations ; 26 cm","","","http://bvbr.bib-bvb.de:8991/F?func=service&doc_library=BVB01&doc_number=017716605&line_number=0001&func_code=DB_RECORDS&service_type=MEDIA","Automobile industry and trade Social aspects United States History.; Automobile industry and trade Social aspects.; Automobile industry and trade United States History.; Automobile industry and trade.; History.; Kraftwagen; Sozialer Wandel; United States.; USA; USA.","","","","","","","","","","","","","","","","","","","","","","","","","","","","","","","","","","","","","","","","","","","","","","",""
"M3CXB2NV","book","2002","Brysk, Alison","Globalization and human rights","","978-0-520-23237-2 978-0-520-23238-9 978-1-59734-636-8","","","http://site.ebrary.com/id/10057114","","2002","2020-09-16 14:32:35","2020-09-23 14:56:24","2020-09-16 14:32:34","","x, 311","","","","","","","","","","University of California Press","Berkeley","English","","","","","WorldCat Discovery Service","","Section: x, 311 pages ; 24 cm","","","","Direitos humanos.; Droits de l'homme (Droit international); Droits de l'homme 1970-2000.; Globalisation; Globalisierung; Globalisierung.; Globalização.; Globalization.; Human rights; Human rights and globalization.; Human rights violations; Human rights.; Information and communications technology; Internationalisatie.; Menschenrecht; Menschenrecht.; Mensenrechten.; Mondialisation 1970-2000.; Mondialisation.; Overseas item; Sex tourism; Sweatshops","","","","","","","","","","","","","","","","","","","","","","","","","","","","","","","","","","","","","","","","","","","","","","",""
"W3X2AJML","book","2015","United States. Congress. House. Committee on Foreign Affairs","Women and technology: increasing opportunity and driving international development : hearing before the Committee on Foreign Affairs, House of Representatives, One Hundred Fourteenth Congress, first session, November 17, 2015.","","","","","http://purl.fdlp.gov/GPO/gpo64576","","2015","2020-09-16 14:32:35","2020-09-23 14:53:59","2020-09-16 14:32:35","","iii, 51","","","","","Women and technology","","","","","U.S. Government Publishing Office","Washington","English","","","","","WorldCat Discovery Service","","Section: iii, 51 pages : illustrations ; 24 cm","","","","Computer networks United States.; Computer networks.; Computers and children United States.; Computers and children.; Internet United States.; Internet.; Legislative hearings.; Sex differences (Psychology) in children United States.; Sex differences (Psychology) in children.; Technology and women United States.; Technology and women.; United States.; Women in technology United States.; Women in technology.","","","","","","","","","","","","","","","","","","","","","","","","","","","","","","","","","","","","","","","","","","","","","","",""
"CWXY34AM","book","2010","Miller, Karen","Male and female roles","","978-0-7377-4528-3 978-0-7377-4529-0","","","","","2010","2020-09-16 14:32:50","2020-09-23 14:45:13","","","229","","","","","","Opposing viewpoints series","","","","Greenhaven Press","Detroit, MI","English","","","","","WorldCat Discovery Service","","Section: 229 pages ; 24 cm.","","","","Juvenile works.; Literature.; Sex role Juvenile literature.; Sex role.","","","","","","","","","","","","","","","","","","","","","","","","","","","","","","","","","","","","","","","","","","","","","","",""
"HKD298T6","book","2006","Yu, Winnie Wing-Man.; Textile Institute (Manchester, England)","Innovation and technology of women's intimate apparel","","978-1-84569-046-5 978-0-8493-9105-7 978-1-84569-169-1","","","http://catdir.loc.gov/catdir/enhancements/fy0745/2007360828-d.html","","2006","2020-09-16 14:32:50","2020-09-23 14:44:24","2020-09-16 14:32:48","","xii, 248","","","","","","Woodhead publishing in textiles","","","","CRC Press ;","Boca Raton, FL","English","","","","","WorldCat Discovery Service","","Section: xii, 248 pages : illustrations ; 25 cm.","","","","Beauty, Personal.; Brassieres.; Foundation garments.; Lingerie féminine.; Lingerie industry Technological innovations.; Lingerie.; Vêtements de femme.","","","","","","","","","","","","","","","","","","","","","","","","","","","","","","","","","","","","","","","","","","","","","","",""
"3I3RQ29J","book","2002","Inayatullah, Sohail; Leggett, Susan.","Transforming communication: technology, sustainability, and future generations","","978-0-275-96944-8 978-0-275-97540-1","","","","","2002","2020-09-16 14:32:50","2020-09-23 14:45:41","","","vi, 200","","","","","Transforming communication","Praeger studies on the 21st century, 1070-1850","","","","Praeger","Westport, Conn.","English","","","","","WorldCat Discovery Service","","Section: vi, 200 pages : illustrations ; 24 cm.","","","","Aufsatzsammlung.; Développement durable.; Duurzaamheid.; Informatietechnologie.; Information technology Social aspects.; Informationstechnik.; Sociale aspecten.; Sozialer Wandel.; Sustainable development.; Technologie de l'information Aspect social.; Telecommunicatie.; Telecommunication Social aspects.; Télécommunications Aspect social.; Telekommunikation.; Toekomstverwachtingen.","","","","","","","","","","","","","","","","","","","","","","","","","","","","","","","","","","","","","","","","","","","","","","",""
"BYFRDP2F","book","2010","Cater-Steel, Aileen; Cater, Emily","Women in engineering, science and technology: education and career challenges","","978-1-61520-657-5 978-1-61520-658-2","","","","","2010","2020-09-16 14:32:50","2020-09-23 14:47:33","","","xxv, 358","","","","","Women in engineering, science and technology","","","","","Engineering Science Reference","Hershey, PA","English","","","","","WorldCat Discovery Service","","Section: xxv, 358 pages : illustrations ; 29 cm","","","","Women Employment.; Women in the professions.; Women scientists.","","","","","","","","","","","","","","","","","","","","","","","","","","","","","","","","","","","","","","","","","","","","","","",""
"BF4JR7GC","book","2009","Prpi&#263;, Katarina.; Oliveira, Luísa.; Hemlin, Sven","Women in science and technology","","978-953-6218-41-7","","","","","2009","2020-09-16 14:32:50","2020-09-23 14:44:47","","","238","","","","","","","","","","Institute for Social Research - Zagreb Sociology of Science and Technology Network of the European Sociological Association","Zagreb","Croatian","","","","","WorldCat Discovery Service","","Section: 238 pages : illustrations ; 24 cm","","","","Feminism and science.; Women in science.; Women in technology.","","","","","","","","","","","","","","","","","","","","","","","","","","","","","","","","","","","","","","","","","","","","","","",""
"DI4EUIC3","book","2005","Cross, Gary S.; Szostak, Rick","Technology and American society: a history","","978-0-13-189643-7","","","","","2005","2020-09-16 14:32:50","2020-09-23 14:47:05","","","xv, 368","","","","","Technology and American society","","","","","Pearson/Prentice Hall","Upper Saddle River, NJ","English","","","","","WorldCat Discovery Service","","Section: xv, 368 pages : illustrations ; 24 cm","","","","History.; Technological innovations Social aspects United States History.; Technological innovations Social aspects.; Technology Social aspects United States History.; Technology Social aspects.; United States.","","","","","","","","","","","","","","","","","","","","","2nd ed.","","","","","","","","","","","","","","","","","","","","","","","","","",""
"9U2DBFM9","book","2004","Caputi, Jane.","Goddesses and monsters: women, myth, power, and popular culture","","978-0-299-19620-2 978-0-299-19624-0","","","http://catdir.loc.gov/catdir/toc/ecip049/2003020572.html","","2004","2020-09-16 14:32:50","2020-09-23 14:47:52","2020-09-16 14:32:49","","x, 468","","","","","Goddesses and monsters","Ray and Pat Browne book","","","","University of Wisconsin Press/Popular Press","Madison","English","","","","","WorldCat Discovery Service","","Section: x, 468 pages : illustrations ; 24 cm.","","","","Analyse féministe.; Beeldvorming.; Critique féministe.; Culture populaire.; Feminist criticism.; Femme.; Femmes dans la culture populaire.; Massamedia.; Patriarcat (Sociologie); Patriarcat.; Patriarchy.; Populaire cultuur.; Popular culture.; Rôle selon le sexe.; Sex role.; Vrouwen.; Women in popular culture.","","","","","","","","","","","","","","","","","","","","","","","","","","","","","","","","","","","","","","","","","","","","","","",""
"ZKLEHI5Z","book","2011","Gayles, Joy Gaston.","Attracting and retaining women in STEM","","978-1-118-29769-8","","","http://onlinelibrary.wiley.com/doi/10.1002/ir.v2011.152/issuetoc","","2011","2020-09-16 14:32:50","2020-09-23 14:46:18","2020-09-16 14:32:49","","106","","","","","","New directions for institutional research, 0271-0579 ; no. 152","","","","Jossey-Bass","San Francisco","English","","","","","WorldCat Discovery Service","","Section: 106 pages : illustrations ; 23 cm.","","","","Engineering Study and teaching (Higher); Engineering Study and teaching (Higher) United States.; Mathematics Study and teaching (Higher); Mathematics Study and teaching (Higher) United States.; Science Study and teaching (Higher); Science Study and teaching (Higher) United States.; Technology Study and teaching (Higher); Technology Study and teaching (Higher) United States.; United States.; Women in engineering Research United States.; Women in mathematics Research United States.; Women in science Research United States.; Women scientists Training of United States.","","","","","","","","","","","","","","","","","","","","","","","","","","","","","","","","","","","","","","","","","","","","","","",""
"3CTJD3MF","book","2009","Abel, Sue.; Bruin, Marjan de.; Nowak, Anita.","Women, advertising and representation: beyond familiar paradigms","","978-1-57273-927-7 978-1-57273-928-4","","","","","2009","2020-09-16 14:32:50","2020-09-23 14:52:44","","","vii, 256","","","","","Women, advertising and representation","The Hampton Press communication series. Women, culture and mass communication","","","","Hampton Press","Cresskill, NJ","English","","","","","WorldCat Discovery Service","","Section: vii, 256 pages ; 24 cm.","","","","Feminism and mass media.; Mass media and women.; Reclame.; Representatie (algemeen); Vrouwen.; Women.","","","","","","","","","","","","","","","","","","","","","","","","","","","","","","","","","","","","","","","","","","","","","","",""
"S9ZCRJTZ","book","2012","Afshar, Haleh","Women and fluid identities: strategic and practical pathways selected by women","","978-0-230-31409-2","","","http://www.netread.com/jcusers2/bk1388/092/9780230314092/image/lgcover.9780230314092.jpg","","2012","2020-09-16 14:32:50","2020-09-23 14:48:15","2020-09-16 14:32:50","","xii, 195","","","","","Women and fluid identities","","","","","Palgrave Macmillan","Houndmills, Basingstoke, Hampshire ;","English","","","","","WorldCat Discovery Service","","Section: xii, 195 pages ; 25 cm","","","","Developing countries.; Feminism Developing countries.; Feminism.; SOCIAL SCIENCE Emigration & Immigration.; SOCIAL SCIENCE Ethnic Studies General.; SOCIAL SCIENCE Feminism & Feminist Theory.; SOCIAL SCIENCE Sociology General.; SOCIAL SCIENCE Women's Studies.; Women Developing countries Identity.; Women Identity.; Women in development Developing countries.; Women in development.","","","","","","","","","","","","","","","","","","","","","","","","","","","","","","","","","","","","","","","","","","","","","","",""
"R9AKV8FM","book","2004","Mays, Dorothy A.","Women in early America: struggle, survival, and freedom in a new world","","978-1-85109-429-5 978-1-85109-434-9","","","http://link.library.utoronto.ca/eir/EIRdetail.cfm?Resources__ID=890600&T=F","","2004","2020-09-16 14:33:09","2020-09-23 14:42:33","2020-09-16 14:33:07","","xxi, 495","","","","","Women in early America","","","","","ABC-CLIO","Santa Barbara, Calif.","English","","","","","WorldCat Discovery Service","","Section: xxi, 495 pages : illustrations ; 29 cm","","","","Encyclopedias.; États-Unis Conditions sociales Jusqu'à 1865 Encyclopédies.; États-Unis Histoire ca 1600-1775 (Période coloniale) Encyclopédies.; Femmes États-Unis Conditions sociales Encyclopédies.; Femmes États-Unis Histoire 17e siècle Encyclopédies.; Femmes États-Unis Histoire 18e siècle Encyclopédies.; Frau.; History.; Lebensbedingungen; Nordamerika; Reference works.; Social conditions; To 1865; United States History Colonial period, ca. 1600-1775 Encyclopedias.; United States Social conditions To 1865 Encyclopedias.; United States.; Women Social conditions.; Women United States History 17th century Encyclopedias.; Women United States History 18th century Encyclopedias.; Women United States Social conditions Encyclopedias.; Women.","","","","","","","","","","","","","","","","","","","","","","","","","","","","","","","","","","","","","","","","","","","","","","",""
"JAREX379","book","2007","Yi, Kongjubok.; Ch&#335;n'guk Y&#335;s&#335;ng Kwahak Kisurin Chiw&#335;n Sent'&#335; (Korea)","Women in science & technology: why and how must they be supported?","","","","","","","2007","2020-09-16 14:33:09","2020-09-23 14:40:38","","","xx, 135","","","","","Women in science & technology","NIS-WIST strategic report","","","","NIS WIST Women in Science and Technology","Seoul, Korea","English","","","","","WorldCat Discovery Service","","Section: xx, 135 pages : illustrations ; 26 cm.","","","","Korea (South); Kvinnliga vetenskapsmän Sydkorea.; Kvinnor och teknik Sydkorea.; Women Employment Korea (South); Women Employment.; Women in engineering Korea (South); Women in engineering.; Women in science Korea (South); Women in science.","","","","","","","","","","","","","","","","","","","","","","","","","","","","","","","","","","","","","","","","","","","","","","",""
"LULZH63W","book","2017","Gagne, Tammy","Women in engineering","","978-1-68078-267-7","","","131710","","2017","2020-09-16 14:33:09","2020-09-23 14:43:18","2020-09-16 14:33:07","","48","","","","","","Women in STEM","","","","Core Library, an imprint of Abdo Publishing","Mankato, Minnesota","English","","","","","WorldCat Discovery Service","","Section: 48 pages : illustrations (chiefly color) ; 24 cm.","","","","Engineering Vocational guidance.; Juvenile works.; Literature.; Technology Vocational guidance.; Vocational guidance.; Women engineers.; Women in engineering Juvenile literature.; Women in engineering.","","","","","","","","","","","","","","","","","","","","","","","","","","","","","","","","","","","","","","","","","","","","","","",""
